{
  "schema_version": 1,
  "generated_at": "2026-10-02T20:13:10.126406+00:00",
  "contract_versions": {
    "module_manifest": 1,
    "package_manifest": 1,
    "research_record": 1,
    "content_project": 1,
    "tuning_adapter": 1,
    "integration_context": 1
  },
  "packages": [
    {
      "id": "embervault.eml-tuning-adapter",
      "name": "EmberVault EML Tuning Adapter",
      "version": "0.1.0",
      "author": "EmberVault",
      "description": "Research-only EML adapter for the evidenced BalancingTable scalar boundary.",
      "package_type": "mod",
      "required_builds": [
        "1076226"
      ],
      "dependencies": [],
      "path": null
    },
    {
      "id": "embervault.example-mod",
      "name": "Embervault Example Mod",
      "version": "0.1.0",
      "author": "Embervault",
      "description": "A safe sample package used to demonstrate profile-scoped enablement.",
      "package_type": "mod",
      "required_builds": [],
      "dependencies": [],
      "path": null
    }
  ],
  "modules": [
    {
      "id": "embervault.content-creator",
      "name": "Content Creator Worker",
      "version": "0.1.0",
      "publisher": "EmberVault",
      "executable": "content_stub.py",
      "minimum_core_version": "0.1.0",
      "capabilities": [
        "content-creator"
      ],
      "feature_state": "experimental",
      "entrypoint": null,
      "process_mode": "separate",
      "path": null
    },
    {
      "id": "embervault.example",
      "name": "Example Module",
      "version": "0.1.0",
      "publisher": "EmberVault",
      "executable": null,
      "minimum_core_version": "0.1.0",
      "capabilities": [
        "example.inspect"
      ],
      "feature_state": "experimental",
      "entrypoint": "module.py",
      "process_mode": "embedded",
      "path": null
    },
    {
      "id": "embervault.research",
      "name": "Research Lab Worker",
      "version": "0.1.0",
      "publisher": "EmberVault",
      "executable": "research_stub.py",
      "minimum_core_version": "0.1.0",
      "capabilities": [
        "research"
      ],
      "feature_state": "experimental",
      "entrypoint": null,
      "process_mode": "separate",
      "path": null
    },
    {
      "id": "embervault.trainer",
      "name": "Trainer (Guarded Stub)",
      "version": "0.1.0",
      "publisher": "EmberVault",
      "executable": "trainer_stub.py",
      "minimum_core_version": "0.1.0",
      "capabilities": [
        "trainer",
        "trainer.recovery"
      ],
      "feature_state": "experimental",
      "entrypoint": null,
      "process_mode": "separate",
      "path": null
    },
    {
      "id": "embervault.tuning-audit",
      "name": "Game Settings Audit",
      "version": "0.1.0",
      "publisher": "EmberVault",
      "executable": "tuning_stub.py",
      "minimum_core_version": "0.1.0",
      "capabilities": [
        "tuning-audit"
      ],
      "feature_state": "experimental",
      "entrypoint": null,
      "process_mode": "separate",
      "path": null
    }
  ],
  "tuning_adapters": [
    {
      "id": "embervault.eml-balancing-table",
      "name": "EML Balancing Table Adapter",
      "version": "0.1.0",
      "loader": "EML",
      "game_build": "1076226",
      "supported_setting_keys": [
        "baseCritChance"
      ],
      "feature_state": "experimental",
      "process_mode": "separate",
      "evidence_state": "reversible-runtime-evidence"
    }
  ],
  "knowledge": [
    {
      "id": "capability-audit-promotion-rule",
      "title": "Capability audit and promotion rule",
      "category": "Research",
      "summary": "Promote capabilities only after runtime, build, and behavior evidence agree.",
      "content": "The capability audit baseline recorded for build 1076226 separates verified, experimental, research-only, and unsupported work. A capability should move toward stable status only after its runtime boundary, current-build compatibility, and relevant in-game behavior are independently documented. Successful offline generation alone is not proof of in-game behavior.",
      "published_at": "seeded",
      "tags": [],
      "related_ids": [],
      "evidence_refs": [],
      "version": 1
    },
    {
      "id": "capability-status-labels",
      "title": "Capability status labels",
      "category": "Research",
      "summary": "Separate verified, experimental, research-only, and blocked work.",
      "content": "Verified route means the documented boundary has passed its evidence requirements. Experimental means controlled testing is possible while important questions remain. Research-only belongs in an isolated profile or disposable world. Blocked means a missing dependency, unsafe boundary, or unresolved failure prevents promotion.",
      "published_at": "seeded",
      "tags": [],
      "related_ids": [],
      "evidence_refs": [],
      "version": 1
    },
    {
      "id": "evidence-before-claims",
      "title": "Evidence before in-game claims",
      "category": "Research",
      "summary": "An offline build or registration result does not prove visible in-game behavior.",
      "content": "Treat successful validation, packaging, or runtime registration as an intermediate result only. A feature should remain experimental or research-only until the target Enshrouded build has fresh runtime evidence and, where relevant, in-game visual confirmation. Record the build context and limitations before promoting the result.",
      "published_at": "seeded",
      "tags": [],
      "related_ids": [],
      "evidence_refs": [],
      "version": 1
    },
    {
      "id": "furniture-registration-boundary",
      "title": "Furniture registration is not visual proof",
      "category": "Content Creator",
      "summary": "A resource registration route does not prove complete rendering behavior.",
      "content": "The recorded furniture research demonstrates an independent ItemInfo registration route for a specific build. Catalog exposure, mesh and texture rendering, multiplayer behavior, and complete visual presentation require separate evidence. Keep the work in a disposable test world while those boundaries remain research-only.",
      "published_at": "seeded",
      "tags": [],
      "related_ids": [],
      "evidence_refs": [],
      "version": 1
    },
    {
      "id": "game-settings-adapter-boundary",
      "title": "Gameplay settings require an adapter",
      "category": "Research",
      "summary": "Staged tuning is portable input, not a direct game mutation.",
      "content": "The installation exposes client preference settings but no supported native gameplay-tuning document. EmberVault therefore exports staged profile values and keeps live application behind an explicitly identified mod or tuning adapter that declares its input contract, backup requirements, mutation scope, and verification procedure.",
      "published_at": "seeded",
      "tags": [],
      "related_ids": [],
      "evidence_refs": [],
      "version": 1
    },
    {
      "id": "modules",
      "title": "Module boundaries",
      "category": "Architecture",
      "summary": "Modules use contracts and explicit capability boundaries.",
      "content": "Normal workflows can be embedded in Control Center. Trainer, Research, and other higher-risk tools may run as separate processes with an explicit launch context.",
      "published_at": "seeded",
      "tags": [],
      "related_ids": [],
      "evidence_refs": [],
      "version": 1
    },
    {
      "id": "profiles",
      "title": "Profiles and isolation",
      "category": "Core",
      "summary": "Use separate profiles for stable play and research.",
      "content": "The Default profile is intended for stable play. The Research profile is an isolated surface for experimental settings and evidence.",
      "published_at": "seeded",
      "tags": [],
      "related_ids": [],
      "evidence_refs": [],
      "version": 1
    },
    {
      "id": "save-safety",
      "title": "Save safety workflow",
      "category": "Safety",
      "summary": "Inspect and protect saves before experiments.",
      "content": "Save Manager is inspection, backup, verification, restore preview, and safe restore only. It does not directly edit save contents.",
      "published_at": "seeded",
      "tags": [],
      "related_ids": [],
      "evidence_refs": [],
      "version": 1
    }
  ],
  "research": [
    {
      "id": "candidate.kfc.bundle.1076226",
      "title": "Offline Catalog",
      "category": "Research",
      "summary": "The recorded rebuild normalized ItemInfo, ItemRegistry, recipe, blueprint, terrain, building, material, feedback, and snap-rule relationships for its named input bundle.",
      "content": "The recorded rebuild normalized ItemInfo, ItemRegistry, recipe, blueprint, terrain, building, material, feedback, and snap-rule relationships for its named input bundle.",
      "status": "partially-verified",
      "build_scope": [
        "1076226"
      ],
      "confidence": "high-for-recorded-inputs",
      "limitations": [
        "The recorded counts are not universal game totals and do not prove runtime mutation or compatibility with later builds."
      ],
      "open_questions": [
        "Can the normalized catalog be imported into the Research index with reproducible source hashes?"
      ],
      "evidence_count": 1,
      "reviewed": true,
      "published_at": "2026-10-02T20:13:10.126406+00:00",
      "version": 1
    },
    {
      "id": "finding.blender.external-tool-capability-map.20260928",
      "title": "external-blender-kfc3-rendermodel-workflow",
      "category": "Research",
      "summary": "The reviewed external Blender workflow documents offline KFC3 RenderModel search, mesh/material import, topology-preserving export, and generated EML package structure.",